id,title,subtitle,authors,publisher,published_date,category,distribution_expense
9780140000000,Weapons of Math Destruction,How Big Data Increases Inequality and Threatens Democracy,Cathy ONeil,Penguin UK,6/9/16,data science,3.19
9811644853,Data Science and Security,Proceedings of IDSCS 2021,"Samiksha Shukla, Aynur Unal, Joseph Varghese Kureethara, Durgesh Kumar Mishra, Dong Seog Han",Springer,27/8/21,data science,6.9
9781450000000,Beautiful Data,The Stories Behind Elegant Data Solutions,"Toby Segaran, Jeff Hammerbacher","""O'Reilly Media, Inc.""",14/7/09,data science,7.3
9780320000000,Data Science for Genomics,,"Amit Kumar Tyagi, Ajith Abraham",Elsevier,15/11/22,data science,4.55
1801779597,Python for Data Analysis,"How to Use Python and Data Science to Better Understand, Summarize, and Investigate Your Data",Andrew Park,Andrew Park,13/2/21,data science,5.6
9780130000000,Bayesian Methods for Hackers,Probabilistic Programming and Bayesian Inference,Cameron Davidson-Pilon,Addison-Wesley Professional,30/9/15,data science,4.22
9781720000000,Dive Into Data Science,Use Python To Tackle Your Toughest Business Challenges,Bradford Tuckfield,No Starch Press,4/7/23,data science,3.19
9781850000000,Guide to Intelligent Data Analysis,How to Intelligently Make Sense of Real Data,"Michael R. Berthold, Christian Borgelt, Frank Höppner, Frank Klawonn",Springer Science & Business Media,23/6/10,data science,6.9
1098121228,Python Data Science Handbook,Essential Tools for Working with Data,Jake VanderPlas,O'Reilly Media,17/1/23,data science,7.3
9789390000000,Practitioner’s Guide to Data Science,"Streamlining Data Science Solutions using Python, Scikit-Learn, and Azure ML Service Platform (English Edition)",Nasir Ali Mirza,BPB Publications,17/1/22,data science,4.55
9783030000000,Visual Analytics for Data Scientists,,"Natalia Andrienko, Gennady Andrienko, Georg Fuchs, Aidan Slingsby, Cagatay Turkay, Stefan Wrobel",Springer Nature,30/8/20,data science,5.6
9781120000000,The Boston Consulting Group on Strategy,Classic Concepts and New Perspectives,"Carl W. Stern, Michael S. Deimler",John Wiley & Sons,14/6/12,data science,4.22
1493938436,Pattern Recognition and Machine Learning,,Christopher M. Bishop,Springer,23/8/16,data science,3.19
9781840000000,Applied Supervised Learning with R,Use machine learning libraries of R to build models that solve business problems and predict future trends,"Karthik Ramasubramanian, Jojo Moolayil",Packt Publishing Ltd,31/5/19,data science,6.9
9783030000000,Machine Learning and Knowledge Discovery in Databases. Applied Data Science Track,"European Conference, ECML PKDD 2021, Bilbao, Spain, September 13–17, 2021, Proceedings, Part IV","Yuxiao Dong, Nicolas Kourtellis, Barbara Hammer, Jose A. Lozano",Springer Nature,9/9/21,data science,7.3
367381893,Statistical Learning and Data Science,,"Mireille Gettler Summa, Leon Bottou, Bernard Goldfarb, Catherine Pardoux, Fionn Murtagh, Myriam Touati",CRC Press,23/9/19,data science,4.55
9781630000000,A Guide to the Project Management Body of Knowledge (PMBOK® Guide) – Seventh Edition and The Standard for Project Management (BRAZILIAN PORTUGUESE),,Project Management Institute Project Management Institute,Project Management Institute,1/8/21,data science,5.6
3030512215,Data Science and Social Research II,"Methods, Technologies and Applications","Paolo Mariani, Mariangela Zenga",Springer,26/11/20,data science,4.22
9781500000000,Introduction to Probability,,"Joseph K. Blitzstein, Jessica Hwang",CRC Press,24/7/14,data science,3.19
9789380000000,Big Data and Hadoop,,VK Jain,KHANNA PUBLISHING,1/1/17,data science,6.9
3031246276,Machine Learning for Data Science Handbook,Data Mining and Knowledge Discovery Handbook,"Lior Rokach, Oded Maimom, Erez Shmueli",Springer,17/8/23,data science,7.3
9811524068,Smart Technologies in Data Science and Communication,Proceedings of SMART-DSC 2019,"Jinan Fiaidhi, Debnath Bhattacharyya, N. Thirupathi Rao",Springer,31/3/20,data science,4.55
9780130000000,"Cognitive Informatics, Computer Modelling, and Cognitive Science","Volume 1: Theory, Case Studies, and Applications","G. R. Sinha, Jasjit S. Suri",Academic Press,7/4/20,data science,5.6
9811624208,Data Science Techniques for Cryptocurrency Blockchains,,Innar Liiv,Springer,25/6/22,data science,4.22
9780010000000,"The Information: A History, a Theory, a Flood",,James Gleick,HarperCollins UK,3/3/11,data science,3.19
9781120000000,Big Data For Dummies,,"Judith S. Hurwitz, Alan Nugent, Fern Halper, Marcia Kaufman",John Wiley & Sons,2/4/13,data science,6.9
9789810000000,Adventures In Financial Data Science: The Empirical Properties Of Financial And Economic Data (Second Edition),,Graham L Giller,World Scientific,27/6/22,data science,7.3
9781450000000,Hands-On Programming with R,Write Your Own Functions and Simulations,Garrett Grolemund,"""O'Reilly Media, Inc.""",13/6/14,data science,4.55
9780130000000,Data Science Applied to Sustainability Analysis,,"Jennifer Dunn, Prasanna Balaprakash",Elsevier,17/5/21,data science,5.6
9783660000000,Data Analytics in Professional Soccer,Performance Analysis Based on Spatiotemporal Tracking Data,Daniel Link,Springer,16/2/18,data science,4.22
9783030000000,Compendium on Enterprise Resource Planning,"Market, Functional and Conceptual View based on SAP S/4HANA",Siar Sarferaz,Springer Nature,1/4/22,data science,3.19
9781540000000,Data Science for Business With R,,"Jeffrey S. Saltz, Jeffrey M. Stanton","SAGE Publications, Incorporated",3/2/21,data science,6.9
9781120000000,Decisively Digital,From Creating a Culture to Designing Strategy,Alexander Loth,John Wiley & Sons,28/5/21,data science,7.3
3030976440,OCaml Scientific Computing,Functional Programming in Data Science and Artificial Intelligence,"Liang Wang, Jianxin Zhao, Richard Mortier",Springer,27/5/22,data science,4.55
9781530000000,Measurement and Data Science,,Gábor Péceli,Cambridge Scholars Publishing,6/1/21,data science,5.6
9780520000000,Combinatorics and Probability,,"Graham Brightwell, Imre Leader, Andrew Thomason, Alex Scott",Cambridge University Press,8/3/07,data science,4.55
192897888,Game Data Science,,"Magy Seif (Professor and Vice Chair of Serious Games El-Nasr, Professor and Vice Chair of Serious Games University of California at Santa Cruz), Professor and Vice Chair of Serious Games Magy Seif El-Nasr, Alessandro (Professor Canossa, Professor The Royal Danish Academy of Fine Arts Schools of Architecture Design and Conservation), Truong-Huy D. (Software Engineer Nguyen","Oxford University Press, USA",10/7/21,data science,5.6
9781800000000,Applied Big Data Analytics and Its Role in COVID-19 Research,,"Zhao, Peng, Chen, Xi",IGI Global,29/4/22,data science,4.22
9781440000000,Privacy in the Age of Big Data,"Recognizing Threats, Defending Your Rights, and Protecting Your Family","Theresa Payton, Ted Claypoole",Rowman & Littlefield,16/1/14,data science,3.19
9811968799,Smart Technologies in Data Science and Communication,Proceedings of SMART-DSC 2022,"Kingsley A. Ogudo, Sanjoy Kumar Saha, Debnath Bhattacharyya",Springer,2/1/23,data science,6.9
1633439658,Causal Inference for Data Science,,Alex Ruiz de Villa,Manning,25/7/23,data science,7.3
367696614,Knowledge Modelling and Big Data Analytics in Healthcare,Advances and Applications,"Mayuri Mehta, Kalpdrum Passi, Indranath Chatterjee, Rajan Patel",CRC Press,25/11/21,data science,4.55
9783830000000,Data Analytics,Models and Algorithms for Intelligent Data Analysis,Thomas A. Runkler,Springer Science & Business Media,26/9/12,data science,5.6
9780740000000,Windows Internals,,"Mark E. Russinovich, David A. Solomon, Alex Ionescu",Pearson Education,15/3/12,data science,4.22
9783320000000,"Theory and Application of Reuse, Integration, and Data Science",,"Thouraya Bouabana-Tebibel, Lydia Bouzar-Benlabiod, Stuart H. Rubin",Springer,7/5/19,data science,3.19
9783030000000,Mathematical Foundations for Data Analysis,,Jeff M. Phillips,Springer Nature,29/3/21,data science,6.9
9789810000000,Data Science,"6th International Conference of Pioneering Computer Scientists, Engineers and Educators, ICPCSEE 2020, Taiyuan, China, September 18-21, 2020, Proceedings, Part II","Pinle Qin, Hongzhi Wang, Guanglu Sun, Zeguang Lu",Springer Nature,20/8/20,data science,7.3
9811520372,Quantitative Economics with R,A Data Science Approach,Vikram Dayal,Springer,4/2/21,data science,4.55
9781590000000,"Automate the Boring Stuff with Python, 2nd Edition",Practical Programming for Total Beginners,Al Sweigart,No Starch Press,12/11/19,data science,5.6
9780750000000,Knowledge Management,An Interdisciplinary Approach for Business Decisions,Shaofeng Liu,Kogan Page Publishers,3/1/20,data science,4.22
9781450000000,Analyzing the Analyzers,An Introspective Survey of Data Scientists and Their Work,"Harlan Harris, Sean Murphy, Marck Vaisman","""O'Reilly Media, Inc.""",10/6/13,data science,3.19
9780320000000,Cognitive Big Data Intelligence with a Metaheuristic Approach,,"Sushruta Mishra, Hrudaya Kumar Tripathy, Pradeep Kumar Mallick, Arun Kumar Sangaiah, Gyoo-Soo Chae",Academic Press,9/11/21,data science,6.9
9781000000000,Operations Research,Operations Research: Theory and Practice,N.V.S Raju,CRC Press,3/9/19,data science,7.3
9811526990,Advanced Studies in Behaviormetrics and Data Science,Essays in Honor of Akinori Okada,"Tadashi Imaizumi, Atsuho Nakayama, Satoru Yokoyama",Springer,5/6/20,data science,4.55
9811659397,Data Science,"7th International Conference of Pioneering Computer Scientists, Engineers and Educators, ICPCSEE 2021, Taiyuan, China, September 17–20, 2021, Proceedings, Part I","Jianchao Zeng, Pinle Qin, Weipeng Jing, Xianhua Song, Zeguang Lu",Springer,11/9/21,data science,5.6
9781910000000,ICICKM 2019 16th International Conference on Intellectual Capital Knowledge Management & Organisational Learning,,"John Dumay, James Guthrie, Rahat Munir",Academic Conferences and publishing limited,5/12/19,data science,4.22
9783320000000,Conquering Big Data with High Performance Computing,,Ritu Arora,Springer,16/9/16,data science,3.19
1482232111,Healthcare Data Analytics,,"Chandan K. Reddy, Charu C. Aggarwal",Chapman and Hall/CRC,23/6/15,data science,6.9
1653684771,Coding with Python,"The Ultimate Guide For Data Science, a Smart Way to Program With Python, Understand Data Analytics and Deep Learning Faster Computer Programming for Beginners",Tim Wired,Independently Published,31/12/19,data science,7.3
9789390000000,Hands-on Data Analysis and Visualization with Pandas,"Engineer, Analyse and Visualize Data, Using Powerful Python Libraries",PURNA CHANDER RAO. KATHULA,BPB Publications,13/8/20,data science,4.55
9781120000000,Predictive Analytics,"The Power to Predict Who Will Click, Buy, Lie, or Die",Eric Siegel,John Wiley & Sons,13/1/16,data science,5.6
9781480000000,Julia Quick Syntax Reference,A Pocket Guide for Data Science Programming,Antonello Lobianco,Apress,11/11/19,data science,4.22
9781350000000,Posthumanism and the Digital University,"Texts, Bodies and Materialities",Lesley Gourlay,Bloomsbury Publishing,10/12/20,data science,3.19
9781120000000,"Mindset Mathematics: Visualizing and Investigating Big Ideas, Grade 1",,"Jo Boaler, Jen Munson, Cathy Williams",John Wiley & Sons,27/1/21,data science,6.9
3319997122,Fundamentals of Clinical Data Science,,"Pieter Kubben, Michel Dumontier, Andre Dekker",Springer,7/1/19,data science,7.3
9781320000000,Introduction to Scientific and Technical Computing,,"Frank T. Willmore, Eric Jankowski, Coray Colina",CRC Press,19/8/16,data science,4.55
9781790000000,Confident Data Skills,How to Work with Data and Futureproof Your Career,Kirill Eremenko,Kogan Page Publishers,10/9/20,data science,5.6
9781910000000,"17th International Conference on Intellectual Capital, Knowledge Management & Organisational Learning",,"Anthony Wensley, Max Evans",Academic Conferences International limited,15/10/20,data science,4.22
9781470000000,Collaborative Knowledge in Scientific Research Networks,,"Diviacco, Paolo",IGI Global,31/10/14,data science,3.19
9811944520,Responsible Data Science,Select Proceedings of ICDSE 2021,"Jimson Mathew, G. Santhosh Kumar, Deepak P., Joemon M. Jose",Springer,21/11/22,data science,6.9
9781320000000,Customer Relationship Management,The Foundation of Contemporary Marketing Strategy,"Roger J. Baran, Robert J. Galka",Taylor & Francis,8/12/16,data science,7.3
1786345390,Statistical Data Science,,"Niall M. Adams, Edward Cohen",Wspc (Europe),24/4/18,data science,4.55
1484288254,Numerical Methods Using Kotlin,"For Data Science, Analysis, and Engineering","Haksun Li, PhD",Apress,1/1/23,data science,5.6
9781950000000,Audit Risk Alert: General Accounting and Auditing Developments 2018/19,,AICPA,John Wiley & Sons,6/12/18,data science,4.55
9789390000000,Artificial Intelligence: How Computers Think,,"Kawal Arora, Ankur Singh Bist, Ir. Untung Rahardja, Ashay Singh",Walnut Publication,2/10/20,data science,5.6
9783320000000,Performability in Internet of Things,,Fadi Al-Turjman,Springer,22/8/18,data science,4.22
9780820000000,Rhetorical Machines,"Writing, Code, and Computational Ethics","John Jones, Lavinia Hirsu",University Alabama Press,2/7/19,data science,3.19
9783320000000,Mining Over Air: Wireless Communication Networks Analytics,,"Ye Ouyang, Mantian Hu, Alexis Huet, Zhongyuan Li",Springer,27/7/18,data science,6.9
9781520000000,Handbook of Research on Information Security in Biomedical Signal Processing,,"Pradhan, Chittaranjan, Das, Himansu, Naik, Bighnaraj",IGI Global,13/4/18,data science,7.3
9783030000000,Supercomputing,"8th Russian Supercomputing Days, RuSCDays 2022, Moscow, Russia, September 26–27, 2022, Revised Selected Papers","Vladimir Voevodin, Sergey Sobolev, Mikhail Yakobovskiy, Rashit Shagaliev",Springer Nature,15/12/22,data science,4.55
9798200000000,Profound Python,,Önder Teker,Godoro,7/8/21,data science,5.6
9780310000000,Managing the NIH Bethesda Campus Capital Assets for Success in a Highly Competitive Global Biomedical Research Environment,,"National Academies of Sciences, Engineering, and Medicine, Division on Engineering and Physical Sciences, Board on Infrastructure and the Constructed Environment, Committee on Assessing the Capital Needs of the National Institutes of Health",National Academies Press,2/10/19,data science,4.22
9781450000000,Compression Schemes for Mining Large Datasets,A Machine Learning Perspective,"T. Ravindra Babu, M. Narasimha Murty, S.V. Subrahmanya",Springer Science & Business Media,19/11/13,data science,3.19
9789810000000,First International Conference on Artificial Intelligence and Cognitive Computing,AICC 2018,"Raju Surampudi Bapi, Koppula Srinivas Rao, Munaga V. N. K. Prasad",Springer,4/11/18,data science,6.9
9781520000000,Human Development and Interaction in the Age of Ubiquitous Technology,,"Rahman, Hakikur",IGI Global,27/6/16,data science,7.3
9781120000000,The Handbook of Peer Production,,"Mathieu ONeil, Christian Pentzold, Sophie Toupin",John Wiley & Sons,2/2/21,data science,4.55
9783640000000,Geospatial Thinking,,"Marco Painho, Maribel Yasmina Santos, Hardy Pundt",Springer Science & Business Media,20/7/10,data science,5.6
9781120000000,People Analytics For Dummies,,Mike West,John Wiley & Sons,20/2/19,data science,4.22
9781000000000,Predictive Analytics,Modeling and Optimization,"Vijay Kumar, Mangey Ram",CRC Press,13/1/21,data science,3.19
9781530000000,Psychology of Education,"Theory, Research and Evidence-Based Practice",Janet Lord,SAGE,12/3/22,data science,6.9
9781520000000,Sentiment Analysis and Knowledge Discovery in Contemporary Business,,"Rajput, Dharmendra Singh, Thakur, Ramjeevan Singh, Basha, S. Muzamil",IGI Global,31/8/18,data science,7.3
9781000000000,Improving Intelligence Analysis in Policing,,"Stuart Kirby, Scott Keay",Routledge,9/6/21,data science,4.55
9783030000000,Concise Guide to Software Engineering,From Fundamentals to Application Methods,Gerard ORegan,Springer Nature,24/9/22,data science,5.6
9781520000000,Applying Business Intelligence Initiatives in Healthcare and Organizational Settings,,"Miah, Shah J., Yeoh, William",IGI Global,13/7/18,data science,4.22
9780840000000,Foundations of Information Ethics,,"John T. F. Burgess, Emily J. M. Knox",American Library Association,3/7/19,data science,3.19
9781120000000,Decisions Over Decimals,Striking the Balance between Intuition and Information,"Christopher J. Frank, Paul F. Magnone, Oded Netzer",John Wiley & Sons,4/10/22,data science,6.9
9781000000000,"Nursing and Informatics for the 21st Century - Embracing a Digital World, 3rd Edition, Book 4","Nursing in an Integrated Digital World that Supports People, Systems, and the Planet","Connie White Delaney, Charlotte Weaver, Joyce Sensmeier, Lisiane Pruinelli, Patrick Weber",CRC Press,29/4/22,data science,7.3
9781320000000,Large-Scale Machine Learning in the Earth Sciences,,"Ashok N. Srivastava, Ramakrishna Nemani, Karsten Steinhaeuser",CRC Press,1/8/17,data science,4.55
9781800000000,Developing Successful Global Strategies for Marketing Luxury Brands,,"Mosca, Fabrizio, Casalegno, Cecilia, Gallo, Rosalia",IGI Global,26/3/21,data science,5.6
9783030000000,Recent Advances in Intelligent Engineering,Volume Dedicated to Imre J. Rudas’ Seventieth Birthday,"Levente Kovács, Tamás Haidegger, Anikó Szakál",Springer,15/3/19,data science,4.22
9781790000000,Python Feature Engineering Cookbook,"Over 70 recipes for creating, engineering, and transforming features to build machine learning models",Soledad Galli,Packt Publishing Ltd,22/1/20,data science,3.19
9781780000000,Mastering Splunk,,James Miller,Packt Publishing Ltd,17/12/14,data science,6.9
9780260000000,Signals and Boundaries,Building Blocks for Complex Adaptive Systems,John H. Holland,MIT Press,10/1/14,data science,7.3
1491907339,Think Stats,,Allen B. Downey,Oreilly & Associates Incorporated,27/10/14,data science,4.55
9780060000000,The Visual Miscellaneum,A Colorful Guide to the World's Most Consequential Trivia,David McCandless,HarperCollins,21/10/14,data science,5.6
OSU:32435009222415,"Proceedings of the Computer Science and Statistics Eleventh Annual Symposium on the Interface, Held at North Carolina State University, Raleigh, N.C., March 6 and 7, 1978",,"A. Ronald Gallant, Thomas M. Gerig","Raleigh, N.C. : by the Institute of Statistics",1/1/78,data science,4.22
1003093450,Supervised Machine Learning for Text Analysis in R,,"Emil Hvitfeldt, Julia Sigle",CRC Press,1/10/21,data science,3.19
9780070000000,Predictive Analytics Using Oracle Data Miner,"Develop & Use Data Mining Models in ODM, SQL & PL/SQL",Brendan Tierney,McGraw Hill Professional,8/8/14,data science,6.9
9780240000000,How to Speak Machine,Laws of Design for a Digital Age,John Maeda,Penguin UK,19/11/19,data science,7.3
UOM:39015002095381,Fourth Inventory Computr/h,,"John W. Hamblen, Carolyn P. Landis",Westview Press,28/4/80,data science,4.55
3030754596,Statistics in the Public Interest,In Memory of Stephen E. Fienberg,"Alicia L. Carriquiry, Judith M. Tanur, William F. Eddy",Springer,23/4/22,data science,5.6
9781640000000,Machine Learning Bookcamp,Build a portfolio of real-life projects,Alexey Grigorev,Simon and Schuster,23/11/21,data science,4.55
UOM:39015030992542,Scientific Information Activities of the National Academy of Sciences-National Research Council,A Report,National Research Council (U.S.). Office of Documentation,National Academies,1/1/62,data science,5.6
9781000000000,Data Analytics,A Small Data Approach,"Shuai Huang, Houtao Deng",CRC Press,16/4/21,data science,4.22
9781640000000,Deep Learning with JavaScript,Neural networks in TensorFlow.js,"Stanley Bileschi, Eric Nielsen, Shanqing Cai",Simon and Schuster,24/1/20,data science,3.19
UCSD:31822000037648,Ad Mare: Canada Looks to the Sea,A Study on Marine Science and Technology,"Robert William Stewart, Lloyd Merlin Dickie",Science Council of Canada,1/1/71,data science,6.9
UCSD:31822032277600,Plate Boundary Zones,,"Seth Stein, Jeffrey T. Freymueller",American Geophysical Union,21/1/02,data science,7.3
9781590000000,Python Crash Course,"A Hands-On, Project-Based Introduction to Programming",Eric Matthes,No Starch Press,1/11/15,data science,4.55
9780260000000,AI Ethics,,Mark Coeckelbergh,MIT Press,5/2/20,data science,5.6
9781000000000,Psychological Perspectives on Praise,,Eddie Brummelman,Routledge,21/7/20,data science,4.22
194505123X,SQL QuickStart Guide,"The Simplified Beginner's Guide to Managing, Analyzing, and Manipulating Data With SQL",Walter Shields,Clydebank Media LLC,4/11/19,data science,3.19
1484234944,Business Case Analysis with R,Simulation Tutorials to Support Complex Business Decisions,Robert D. Brown III,Apress,3/3/18,data science,6.9
9780190000000,Pharmaceutical Medicine,,"Adrian Kilcoyne, Phil Ambery, Daniel OConnor",OUP Oxford,23/5/13,data science,7.3
1848829469,Computer Vision,Algorithms and Applications,Richard Szeliski,Springer,5/11/10,data science,4.55
9789540000000,Theory and Applications for Advanced Text Mining,,Shigeaki Sakurai,BoD – Books on Demand,21/11/12,data science,5.6
9781120000000,Effective Data Storytelling,"How to Drive Change with Data, Narrative and Visuals",Brent Dykes,John Wiley & Sons,10/12/19,data science,4.22
9781260000000,"Fixed Income Mathematics, Fifth Edition: Analytical and Statistical Techniques",,"Frank J. Fabozzi, Francesco Fabozzi",McGraw Hill Professional,6/9/22,data science,3.19
9811533563,Applications of Machine Learning,,"Prashant Johri, Jitendra Kumar Verma, Sudip Paul",Springer,5/5/20,data science,6.9
1138480452,Blogdown,Creating Websites with R Markdown,"Yihui Xie, Alison Presmanes Hill, Amber Thomas",CRC Press,12/12/17,data science,7.3
1617296082,Practices of the Python Pro,,Dane Hillard,Manning Publications,14/1/20,data science,4.55
9781320000000,Engineering Entrepreneurship from Idea to Business Plan,A Guide for Innovative Engineers and Scientists,Paul Swamidass,Cambridge University Press,26/10/16,data science,5.6
359828523,Analytics,"Data Science, Data Analysis and Predictive Analytics for Business",Daniel Covington,Lulu.com,13/8/19,data science,4.22
9781610000000,Algorithms for Reinforcement Learning,,Csaba Szepesvari,Morgan & Claypool Publishers,8/8/10,data science,3.19
1461455901,Handbook of Damage Mechanics,Nano to Macro Scale for Materials and Structures,George Z. Voyiadjis,Springer,14/10/14,data science,6.9
3031004604,Graph Representation Learning,,William L. Hamilton,Springer,16/9/20,data science,7.3
3319673769,Contingency and Natural Order in Early Modern Science,,"Pietro Daniel Omodeo, Rodolfo Garau",Springer,20/9/19,data science,4.55
OSU:32435019744671,Yearbook of International Organizations,,Union of International Associations,International Publications Service,1/12/81,data science,5.6
303041888X,Distributed Graph Analytics,"Programming, Languages, and Their Compilation","Unnikrishnan Cheramangalath, Rupesh Nasre, Y. N. Srikant",Springer,18/4/21,data science,4.22
9781480000000,R Data Science Quick Reference,"A Pocket Guide to APIs, Libraries, and Packages",Thomas Mailund,Apress,7/8/19,data science,3.19
71807594,A PRACTITIONER'S GUIDE TO BUSINESS ANALYTICS: Using Data Analysis Tools to Improve Your Organization’s Decision Making and Strategy,,Randy Bartlett,McGraw-Hill Education,5/2/13,data science,6.9
9780120000000,Implementing Analytics,"A Blueprint for Design, Development, and Adoption",Nauman Sheikh,Newnes,6/5/13,data science,7.3
309097347,Struck by Lightning,The Curious World of Probabilities,Jeffrey S. Rosenthal,National Academies Press,28/4/06,data science,4.55
1589062604,Guidelines for Foreign Exchange Reserve Management,,International Monetary Fund,International Monetary Fund,16/8/04,data science,5.6
9781120000000,Introductory Statistics and Analytics,A Resampling Perspective,Peter C. Bruce,John Wiley & Sons,8/1/15,data science,4.22
9780190000000,Big Data: A Very Short Introduction,,Dawn E. Holmes,Oxford University Press,16/11/17,data science,3.19
9781640000000,Classic Computer Science Problems in Java,,David Kopec,Simon and Schuster,21/12/20,data science,6.9
UOM:39015029885772,Satellite Altimetry in Geodesy and Oceanography,,"Reiner Rummel, Fernando Sansò",Springer,23/6/93,data science,7.3
9780260000000,"Streaming, Sharing, Stealing",Big Data and the Future of Entertainment,"Michael D. Smith, Rahul Telang",MIT Press,25/8/17,data science,4.55
9781120000000,Real-Time Embedded Systems,,Jiacun Wang,John Wiley & Sons,10/7/17,data science,5.6
9780390000000,Naked Economics: Undressing the Dismal Science,,Charles Wheelan,W. W. Norton & Company,17/9/03,data science,4.55
9781590000000,The Manga Guide to Linear Algebra,,"Shin Takahashi, Iroha Inoue, Co Ltd Trend",National Geographic Books,1/5/12,data science,5.6
1484230957,Pro Deep Learning with TensorFlow,A Mathematical Approach to Advanced Artificial Intelligence in Python,Santanu Pattanayak,Apress,7/12/17,data science,4.22
9781110000000,Data Mining and Machine Learning,Fundamental Concepts and Algorithms,"Mohammed J. Zaki, Wagner Meira, Jr",Cambridge University Press,31/12/19,data science,3.19
1617294470,Kafka Streams in Action,Real-time apps and microservices with the Kafka Streams API,Bill Bejeck,Manning Publications,16/9/18,data science,6.9
3030598918,Statistics for Health Data Science,An Organic Approach,"Ruth Etzioni, Micha Mandel, Roman Gulati",Springer,6/1/22,data science,7.3
3030202895,A Beginners Guide to Python 3 Programming,,John Hunt,Springer,13/8/19,data science,4.55
3642372244,Computing Nature,Turing Centenary Perspective,"Gordana Dodig-Crnkovic, Raffaela Giovagnoli",Springer,6/4/13,data science,5.6
9781110000000,Mathematics for Machine Learning,,"Marc Peter Deisenroth, A. Aldo Faisal, Cheng Soon Ong",Cambridge University Press,23/4/20,maths,4.22
9780430000000,Probability and Statistics for Data Science,Math + R + Data,Norman Matloff,CRC Press,21/6/19,maths,3.19
