id,title,subtitle,authors,publisher,published_date,category,distribution_expense
9781450000000,Python Cookbook,Recipes for Mastering Python 3,"David Beazley, Brian K. Jones","""O'Reilly Media, Inc.""",10/5/13,SQL,4.22
9781490000000,Graph Algorithms,Practical Examples in Apache Spark and Neo4j,"Mark Needham, Amy E. Hodler","""O'Reilly Media, Inc.""",16/5/19,SQL,3.19
9780990000000,Negotiating for Success: Essential Strategies and Skills,,George J. Siedel,"Van Rye Publishing, LLC",4/10/14,SQL,6.9
9781490000000,Practical Statistics for Data Scientists,50 Essential Concepts,"Peter Bruce, Andrew Bruce","""O'Reilly Media, Inc.""",10/5/17,SQL,7.3
9781720000000,"Practical SQL, 2nd Edition",A Beginner's Guide to Storytelling with Data,Anthony DeBarros,No Starch Press,25/1/22,SQL,4.55
9781490000000,Python for Data Analysis,"Data Wrangling with Pandas, NumPy, and IPython",Wes McKinney,"""O'Reilly Media, Inc.""",25/9/17,SQL,5.6
9781000000000,Introduction to Data Science,Data Analysis and Prediction Algorithms with R,Rafael A. Irizarry,CRC Press,20/11/19,SQL,4.22
1558605762,Joe Celko's SQL for Smarties,Advanced SQL Programming Second Edition,Joe Celko,Morgan Kaufmann,11/10/99,SQL,3.19
9780530000000,Learning How to Learn,How to Succeed in School Without Spending All Your Time Studying; A Guide for Kids and Teens,"Barbara Oakley, PhD, Terrence Sejnowski, PhD, Alistair McConville",Penguin,7/8/18,SQL,6.9
9781120000000,Smarter Data Science,Succeeding with Enterprise-Grade Data and AI Projects,"Neal Fishman, Cole Stryker",John Wiley & Sons,14/4/20,SQL,7.3
9781120000000,Responsible Data Science,,"Peter C. Bruce, Grant Fleming",John Wiley & Sons,13/4/21,SQL,4.55
9780130000000,T-SQL Querying,,"Itzik Ben-Gan, Adam Machanic, Dejan Sarka, Kevin Farlee",Microsoft Press,17/2/15,SQL,5.6
9781510000000,T-SQL Fundamentals,,Itzik Ben-Gan,Microsoft Press,29/7/16,SQL,4.22
9781450000000,Learning Spark,Lightning-Fast Big Data Analysis,"Holden Karau, Andy Konwinski, Patrick Wendell, Matei Zaharia","""O'Reilly Media, Inc.""",28/1/15,SQL,3.19
9781840000000,Hands-On Machine Learning with scikit-learn and Scientific Python Toolkits,A practical guide to implementing supervised and unsupervised machine learning algorithms in Python,Tarek Amr,Packt Publishing Ltd,24/7/20,SQL,6.9
9780600000000,Head First SQL,Your Brain on SQL -- A Learner's Guide,Lynn Beighley,"""O'Reilly Media, Inc.""",28/8/07,SQL,7.3
9781450000000,Doing Data Science,Straight Talk from the Frontline,"Cathy ONeil, Rachel Schutt","""O'Reilly Media, Inc.""",9/10/13,SQL,4.55
9781950000000,SQL QuickStart Guide,"The Simplified Beginner's Guide to Managing, Analyzing, and Manipulating Data With SQL",Walter Shields,ClydeBank Media LLC,18/11/19,SQL,5.6
9781120000000,Data Science For Dummies,,Lillian Pierson,John Wiley & Sons,6/3/17,SQL,4.22
9780130000000,"SQL in 10 Minutes, Sams Teach Yourself",,Ben Forta,Sams Publishing,25/10/12,SQL,3.19
9781460000000,R for Business Analytics,,A Ohri,Springer Science & Business Media,14/9/12,SQL,6.9
9781120000000,The Boston Consulting Group on Strategy,Classic Concepts and New Perspectives,"Carl W. Stern, Michael S. Deimler",John Wiley & Sons,14/6/12,SQL,7.3
9781000000000,Data Science and Its Applications,,"Aakanksha Sharaff, G R Sinha",CRC Press,18/8/21,SQL,4.55
9781120000000,Excel 2016 Bible,,John Walkenbach,John Wiley & Sons,26/10/15,SQL,5.6
UOM:39015034891690,Relational Database Systems,,"Dan A. Simovici, Richard L. Tenney",Academic Press,15/8/95,SQL,4.55
9781000000000,A Tour of Data Science,Learn R and Python in Parallel,Nailong Zhang,CRC Press,11/11/20,SQL,5.6
9781630000000,NoSQL and SQL Data Modeling,"Bringing Together Data, Semantics, and Software",Ted Hills,Technics Publications,1/4/16,SQL,4.22
9781450000000,SQL in a Nutshell,A Desktop Quick Reference,"Kevin Kline, Brand Hunt, Daniel Kline","""O'Reilly Media, Inc.""",24/9/04,SQL,3.19
1572229160,SQL Guide,,"John Hales, BarCharts Inc., Staff",Quickstudy,1/1/05,SQL,6.9
9780140000000,"SQL in 10 Minutes a Day, Sams Teach Yourself",,Ben Forta,Sams Publishing,29/10/19,SQL,7.3
9781450000000,Introduction to Machine Learning with Python,A Guide for Data Scientists,"Andreas C. Müller, Sarah Guido","""O'Reilly Media, Inc.""",26/9/16,SQL,4.55
9780600000000,The Art of SQL,,"Stephane Faroult, Peter Robson","""O'Reilly Media, Inc.""",10/3/06,SQL,5.6
9780600000000,Head First Statistics,,Dawn Griffiths,"""O'Reilly Media, Inc.""",26/8/08,SQL,4.22
9781620000000,"PostGIS in Action, Third Edition",,"Leo S. Hsu, Regina Obe",Simon and Schuster,21/9/21,SQL,3.19
9781730000000,Rise of the Data Cloud,,"Frank Slootman, Steve Hamm",AuthorHouse,18/12/20,SQL,6.9
9781780000000,Pandas Cookbook,"Recipes for Scientific Computing, Time Series Analysis and Data Visualization using Python",Theodore Petrou,Packt Publishing Ltd,23/10/17,SQL,7.3
9781120000000,SQL For Dummies,,Allen G. Taylor,John Wiley & Sons,11/12/18,SQL,4.55
9781480000000,Beginning SQL Server R Services,Analytics for Data Scientists,Bradley Beard,Apress,11/11/16,SQL,5.6
9780470000000,SQL All-in-One For Dummies,,Allen G. Taylor,John Wiley & Sons,5/4/11,SQL,4.22
9781840000000,Deep Learning with TensorFlow 2 and Keras,"Regression, ConvNets, GANs, RNNs, NLP, and more with TensorFlow 2 and the Keras API, 2nd Edition","Antonio Gulli, Amita Kapoor, Sujit Pal",Packt Publishing Ltd,27/12/19,SQL,3.19
1727287320,Heard in Data Science Interviews,Over 650 Most Commonly Asked Interview Questions and Answers,Kal Mishra,Createspace Independent Publishing Platform,3/10/18,SQL,6.9
9781120000000,Data Science and Big Data Analytics,"Discovering, Analyzing, Visualizing and Presenting Data",EMC Education Services,John Wiley & Sons,5/1/15,SQL,7.3
1634629663,Building the Data Lakehouse,,"Bill Inmon, Ranjeet Srivastava, Mary Levins",Technics Publications,1/10/21,SQL,4.55
9781490000000,Data Pipelines Pocket Reference,,James Densmore,O'Reilly Media,10/2/21,SQL,5.6
9781790000000,40 Algorithms Every Programmer Should Know,Hone your problem-solving skills by learning different algorithms and their implementation in Python,Imran Ahmad,Packt Publishing Ltd,12/6/20,SQL,4.22
9781640000000,Think Like a Data Scientist,Tackle the data science process step-by-step,Brian Godsey,Simon and Schuster,9/3/17,SQL,3.19
9781790000000,Artificial Intelligence with Python,,Prateek Joshi,Packt Publishing Ltd,27/1/17,SQL,6.9
9781450000000,Think Stats,,Allen B. Downey,"""O'Reilly Media, Inc.""",1/7/11,SQL,7.3
9781450000000,Learning Python,Powerful Object-Oriented Programming,Mark Lutz,"""O'Reilly Media, Inc.""",12/6/13,SQL,4.55
9781640000000,Learn SQL Server Administration in a Month of Lunches,,Don Jones,Simon and Schuster,30/4/14,SQL,5.6
9781490000000,High Performance Python,Practical Performant Programming for Humans,"Micha Gorelick, Ian Ozsvald",O'Reilly Media,30/4/20,SQL,4.22
1540422658,SQL Practice Problems,"57 Beginning, Intermediate, and Advanced Challenges for You to Solve Using a ""Learn-by-doing"" Approach",Sylvia Moestl Vasilik,Createspace Independent Publishing Platform,9/11/16,SQL,3.19
9781460000000,Relational Database Systems,,Jitendra Patel,eBookIt.com,1/12/12,SQL,6.9
9781790000000,SQL Server 2017 Machine Learning Services with R,"Data exploration, modeling, and advanced analytics","Tomaz Kastrun, Julie Koesmarno",Packt Publishing Ltd,27/2/18,SQL,7.3
9781450000000,Machine Learning for Hackers,Case Studies and Algorithms to Get You Started,"Drew Conway, John Myles White","""O'Reilly Media, Inc.""",13/2/12,SQL,4.55
9781780000000,Mastering Python for Data Science,,Samir Madhavan,Packt Publishing Ltd,31/8/15,SQL,5.6
9781630000000,Experimentation Works,The Surprising Power of Business Experiments,Stefan H. Thomke,Harvard Business Press,18/2/20,SQL,4.22
9781590000000,"Automate the Boring Stuff with Python, 2nd Edition",Practical Programming for Total Beginners,Al Sweigart,No Starch Press,12/11/19,SQL,3.19
9781530000000,Measurement and Data Science,,Gábor Péceli,Cambridge Scholars Publishing,6/1/21,SQL,6.9
9780130000000,Bayesian Methods for Hackers,Probabilistic Programming and Bayesian Inference,Cameron Davidson-Pilon,Addison-Wesley Professional,30/9/15,SQL,7.3
9386551934,Machine Learning with Python,,Abhishek Vijayvargia,BPB Publications,1/3/18,SQL,4.55
9781450000000,The Art of Readable Code,Simple and Practical Techniques for Writing Better Code,"Dustin Boswell, Trevor Foucher","""O'Reilly Media, Inc.""",3/11/11,SQL,5.6
1617291560,Practical Data Science with R,,"Nina Zumel, John Mount",Manning Publications,10/4/14,SQL,4.55
9781120000000,The Unlucky Investor's Guide to Options Trading,,Julia Spina,John Wiley & Sons,23/2/22,SQL,5.6
9780130000000,NoSQL Distilled,A Brief Guide to the Emerging World of Polyglot Persistence,"Pramod J. Sadalage, Martin Fowler",Addison-Wesley,8/8/12,SQL,4.22
9781790000000,SQL Server 2016 Developer's Guide,,"Dejan Sarka, Milos Radivojevic, William Durkin",Packt Publishing Ltd,22/3/17,SQL,3.19
9781480000000,Managing Your Data Science Projects,"Learn Salesmanship, Presentation, and Maintenance of Completed Models",Robert de Graaf,Apress,7/6/19,SQL,6.9
9780140000000,The Signal and the Noise,Why So Many Predictions Fail--but Some Don't,Nate Silver,Penguin,3/2/15,SQL,7.3
9781490000000,R Packages,"Organize, Test, Document, and Share Your Code",Hadley Wickham,"""O'Reilly Media, Inc.""",26/3/15,SQL,4.55
9780390000000,All of Statistics,A Concise Course in Statistical Inference,Larry Wasserman,Springer Science & Business Media,11/12/13,SQL,5.6
9781510000000,Microsoft Excel 2019 Data Analysis and Business Modeling,,Wayne Winston,Microsoft Press,28/3/19,SQL,4.22
9781800000000,Data Science Projects with Python,A case study approach to gaining valuable insights from real data with machine learning,Stephen Klosterman,Packt Publishing Ltd,29/7/21,SQL,3.19
9789390000000,Learn SQL with MySQL,,Pajankar Ashwin,BPB Publications,3/9/20,SQL,6.9
9780130000000,Inflection Point,"How the Convergence of Cloud, Mobility, Apps, and Data Will Shape the Future of Business",Scott Stawski,FT Press,27/8/15,SQL,7.3
9783320000000,Data Science in Practice,,"Alan Said, Vicenç Torra",Springer,19/9/18,SQL,4.55
9780820000000,Introduction to Probability,,"Charles Miller Grinstead, James Laurie Snell",American Mathematical Soc.,30/10/12,SQL,5.6
1720283842,Introduction to Blockchain: With Case Studies,,Zeeshan-Ul-Hassan Usmani,Independently Published,13/9/18,SQL,4.22
9781420000000,The Johns Hopkins Guide to Psychological First Aid,,"George S. Everly, Jr., Jeffrey M. Lating",JHU Press,2/8/22,SQL,3.19
1977921752,Illustrated Guide to Python 3,A Complete Walkthrough of Beginning Python With Unique Illustrations Showing How Python Really Works. Now Covering Python 3.6,Matt Harrison,Createspace Independent Publishing Platform,3/11/17,SQL,6.9
80491685,Joe Celko's SQL Puzzles and Answers,,Joe Celko,Elsevier,9/10/06,SQL,7.3
9780390000000,Dataclysm,"Love, Sex, Race, and Identity--What Our Online Lives Tell Us about Our Offline Selves",Christian Rudder,Crown,8/9/15,SQL,4.55
3030439836,Principles of Data Science,,"Hamid R. Arabnia, Kevin Daimi, Robert Stahlbock, Cristina Soviany, Leonard Heilig, Kai Brüssau",Springer,9/7/21,SQL,5.6
9781120000000,Predictive Analytics,"The Power to Predict Who Will Click, Buy, Lie, or Die",Eric Siegel,John Wiley & Sons,13/1/16,SQL,4.22
9781110000000,Data-Driven Science and Engineering,"Machine Learning, Dynamical Systems, and Control","Steven L. Brunton, J. Nathan Kutz",Cambridge University Press,28/2/19,SQL,3.19
9781620000000,"Machine Learning with TensorFlow, Second Edition",,Mattmann A. Chris,Manning Publications,2/2/21,SQL,6.9
9780260000000,Machine Learning,A Probabilistic Perspective,Kevin P. Murphy,MIT Press,24/8/12,SQL,7.3
9781450000000,Hadoop: The Definitive Guide,,Tom White,"""O'Reilly Media, Inc.""",24/9/10,SQL,4.55
9781490000000,Analytical Skills for AI and Data Science,Building Skills for an AI-Driven Enterprise,Daniel Vaughan,O'Reilly Media,21/5/20,SQL,5.6
9780060000000,Data-ism,"The Revolution Transforming Decision Making, Consumer Behavior, and Almost Everything Else",Steve Lohr,Harper Collins,10/3/15,SQL,4.55
9781110000000,Mathematics for Machine Learning,,"Marc Peter Deisenroth, A. Aldo Faisal, Cheng Soon Ong",Cambridge University Press,23/4/20,SQL,5.6
9781790000000,SQL Server 2017 Integration Services Cookbook,,"Christian Cote, Matija Lah, Dejan Sarka",Packt Publishing Ltd,30/6/17,SQL,4.22
9781110000000,Foundations of Data Science,,"Avrim Blum, John Hopcroft, Ravindran Kannan",Cambridge University Press,23/1/20,SQL,3.19
9783030000000,Linear Algebra and Optimization for Machine Learning,A Textbook,Charu C. Aggarwal,Springer Nature,13/5/20,SQL,6.9
9798580000000,Data Analytics Basics,A Beginner’s Guide,Simplilearn,IndraStra Whitepapers,14/12/20,SQL,7.3
9780810000000,Think Bigger,Developing a Successful Big Data Strategy for Your Business,Mark Van Rijmenam,AMACOM,3/4/14,SQL,4.55
9780750000000,Confident Data Skills,Master the Fundamentals of Working with Data and Supercharge Your Career,Kirill Eremenko,Kogan Page Publishers,3/1/18,SQL,5.6
9781120000000,Data Smart,Using Data Science to Transform Information into Insight,John W. Foreman,John Wiley & Sons,31/10/13,SQL,4.22
1493938436,Pattern Recognition and Machine Learning,,Christopher M. Bishop,Springer,23/8/16,SQL,3.19
9781490000000,The Hitchhiker's Guide to Python,Best Practices for Development,"Kenneth Reitz, Tanya Schlusser","""O'Reilly Media, Inc.""",30/8/16,SQL,6.9
9789390000000,Data Science for Business Professionals,A Practical Guide for Beginners (English Edition),Probyto Data Science and Consulting Pvt. Ltd.,BPB Publications,6/5/20,SQL,7.3
148425984X,SQL Server Big Data Clusters,"Data Virtualization, Data Lake, and AI Platform","Benjamin Weissman, Enrico van de Laar",Apress,17/6/20,SQL,4.55
9781450000000,Data Science for Business,What You Need to Know about Data Mining and Data-Analytic Thinking,"Foster Provost, Tom Fawcett","""O'Reilly Media, Inc.""",27/7/13,SQL,5.6
9781450000000,The River of Consciousness,,Oliver Sacks,Pan Macmillan,19/10/17,SQL,4.22
9781120000000,Tableau For Dummies,,"Molly Monsey, Paul Sochan",John Wiley & Sons,14/10/15,SQL,3.19
9781490000000,Deep Learning for Coders with fastai and PyTorch,,"Jeremy Howard, Sylvain Gugger","""O'Reilly Media, Inc.""",29/6/20,SQL,6.9
8131707490,Software Architecture: A Case Based Approach,,"Vasudeva Varma, Varma Vasudeva",Pearson Education India,1/9/09,SQL,7.3
9781680000000,A Common-Sense Guide to Data Structures and Algorithms,Level Up Your Core Programming Skills,Jay Wengrow,Pragmatic Bookshelf,3/8/17,SQL,4.55
9781790000000,Hands-On Machine Learning with Azure,Build powerful models with cognitive machine learning and artificial intelligence,"Thomas K Abraham, Parashar Shah, Jen Stirrup, Lauri Lehman, Anindita Basak",Packt Publishing Ltd,31/10/18,SQL,5.6
9780260000000,"Fundamentals of Machine Learning for Predictive Data Analytics, second edition","Algorithms, Worked Examples, and Case Studies","John D. Kelleher, Brian Mac Namee, Aoife DArcy",MIT Press,20/10/20,SQL,4.22
9780470000000,Data Mining Techniques,"For Marketing, Sales, and Customer Relationship Management","Michael J. A. Berry, Gordon S. Linoff",John Wiley & Sons,9/4/04,SQL,3.19
9781110000000,Computer Age Statistical Inference,,"Bradley Efron, Trevor Hastie",Cambridge University Press,21/7/16,SQL,6.9
9781490000000,Python for Excel,,Felix Zumstein,"""O'Reilly Media, Inc.""",4/3/21,SQL,7.3
9783030000000,Data Science for Healthcare,Methodologies and Applications,"Sergio Consoli, Diego Reforgiato Recupero, Milan Petković",Springer,23/2/19,SQL,4.55
1721242163,Python Tutorial,Release 3. 6. 6rc1,Guido Rossum,Createspace Independent Publishing Platform,19/6/18,SQL,5.6
1484249062,Managing Your Data Science Projects,"Learn Salesmanship, Presentation, and Maintenance of Completed Models",Robert de Graaf,Apress,8/6/19,SQL,4.22
9781790000000,Mastering Java for Data Science,,Alexey Grigorev,Packt Publishing Ltd,27/4/17,SQL,3.19
9781460000000,Applied Predictive Modeling,,"Max Kuhn, Kjell Johnson",Springer Science & Business Media,17/5/13,SQL,6.9
9781790000000,SQL Server 2017 Developer’s Guide,A professional guide to designing and developing enterprise database applications,"William Durkin, Miloš Radivojević, Dejan Sarka",Packt Publishing Ltd,16/3/18,SQL,7.3
9781470000000,SAS and R,"Data Management, Statistical Analysis, and Graphics, Second Edition","Ken Kleinman, Nicholas J. Horton",CRC Press,17/7/14,SQL,4.55
9781630000000,Good Charts,"The HBR Guide to Making Smarter, More Persuasive Data Visualizations",Scott Berinato,Harvard Business Review Press,26/4/16,SQL,5.6
9780130000000,Pandas for Everyone,Python Data Analysis,Daniel Y. Chen,Addison-Wesley Professional,15/12/17,SQL,4.22
9781790000000,SQL Server 2017 Administrator's Guide,"One stop solution for DBAs to monitor, manage, and maintain enterprise databases","Marek Chmel, Vladimir Muzny",Packt Publishing Ltd,12/12/17,SQL,3.19
9780130000000,Clean Architecture,A Craftsman's Guide to Software Structure and Design,Robert C. Martin,Prentice Hall,12/9/17,SQL,6.9
9780140000000,SQL Server 2019 Administration Inside Out,,"Randolph West, Melody Zacharias, William Assaf, Sven Aelterman, Louis Davidson, Joseph DAntoni",Microsoft Press,11/3/20,SQL,7.3
9781490000000,Fundamentals of Deep Learning,Designing Next-Generation Machine Intelligence Algorithms,"Nikhil Buduma, Nicholas Locascio","""O'Reilly Media, Inc.""",25/5/17,SQL,4.55
9780520000000,Data Mining and Analysis,Fundamental Concepts and Algorithms,"Mohammed J. Zaki, Wagner Meira, Jr, Wagner Meira",Cambridge University Press,12/5/14,SQL,5.6
134872983,Differential Equations and Boundary Value Problems,"Computing and Modeling Tech Update, Books a la Carte Edition","C. Henry Edwards, David E. Penney, David Calvis",Pearson,30/1/18,SQL,4.55
9780130000000,Effective SQL,61 Specific Ways to Write Better SQL,"John L. Viescas, Douglas J. Steele, Ben G. Clothier",Addison-Wesley Professional,9/1/17,SQL,5.6
1506094384,Learn Python in One Day and Learn It Well,Python for Beginners with Hands-On Project. the Only Book You Need to Start Coding in Python Immediately,Jamie Chan,CreateSpace,7/1/15,SQL,4.22
1484230531,Practical Data Science,A Guide to Building the Technology Stack for Turning Data Lakes into Business Assets,Andreas François Vermeulen,Apress,22/2/18,SQL,3.19
9781490000000,I Heart Logs,"Event Data, Stream Processing, and Data Integration",Jay Kreps,"""O'Reilly Media, Inc.""",23/9/14,SQL,6.9
9781490000000,"Hands-On Machine Learning with Scikit-Learn, Keras, and TensorFlow","Concepts, Tools, and Techniques to Build Intelligent Systems",Aurélien Géron,"""O'Reilly Media, Inc.""",5/9/19,SQL,7.3
9780260000000,Deep Learning,,"Ian Goodfellow, Yoshua Bengio, Aaron Courville",MIT Press,10/11/16,SQL,4.55
9780060000000,The Visual Miscellaneum,A Colorful Guide to the World's Most Consequential Trivia,David McCandless,HarperCollins,21/10/14,SQL,5.6
1492086002,Hands-On Data Visualization,Interactive Storytelling from Spreadsheets to Code,"Jack Dougherty, Ilya Ilyankou",O'Reilly Media,30/4/21,SQL,4.22
9781780000000,Python Machine Learning,,Sebastian Raschka,Packt Publishing Ltd,23/9/15,SQL,3.19
1500789240,Bootstrapping Machine Learning,The First Guide to Prediction APIs,Louis Dorard,CreateSpace,11/8/14,SQL,6.9
9781490000000,Natural Language Processing with PyTorch,Build Intelligent Language Applications Using Deep Learning,"Delip Rao, Brian McMahan",O'Reilly Media,22/1/19,SQL,7.3
9781850000000,Big Data,"The Essential Guide to Work, Life and Learning in the Age of Insight","Viktor Mayer-Schonberger, Kenneth Cukier",Hachette UK,14/3/13,SQL,4.55
9781110000000,Mining of Massive Datasets,,"Jure Leskovec, Anand Rajaraman, Jeffrey David Ullman",Cambridge University Press,13/11/14,SQL,5.6
9781630000000,Business unIntelligence,Insight and Innovation beyond Analytics and Big Data,Dr. Barry Devlin,Technics Publications,1/10/13,SQL,4.22
9781490000000,AI for People and Business,A Framework for Better Human Experiences and Business Success,Alex Castrounis,O'Reilly Media,5/7/19,SQL,3.19
9780010000000,"The Information: A History, a Theory, a Flood",,James Gleick,HarperCollins UK,3/3/11,SQL,6.9
9781680000000,Seven Databases in Seven Weeks,A Guide to Modern Databases and the NoSQL Movement,"Luc Perkins, Eric Redmond, Jim Wilson",Pragmatic Bookshelf,5/4/18,SQL,7.3
9781640000000,Machine Learning in Action,,Peter Harrington,Simon and Schuster,3/4/12,SQL,4.55
9781510000000,An Introduction to Data Science,,"Jeffrey S. Saltz, Jeffrey M. Stanton",SAGE Publications,25/8/17,SQL,5.6
9781450000000,Agile Data Science,Building Data Analytics Applications with Hadoop,Russell Jurney,"""O'Reilly Media, Inc.""",15/10/13,SQL,4.22
9780390000000,Naked Statistics: Stripping the Dread from the Data,,Charles Wheelan,W. W. Norton & Company,7/1/13,SQL,3.19
149209434X,Advancing Into Analytics,From Excel to Python and R,George Mount,O'Reilly Media,30/4/21,SQL,6.9
9781490000000,Graphing Data with R,An Introduction,John Jay Hilfiger,"""O'Reilly Media, Inc.""",19/10/15,SQL,7.3
9781850000000,Hadoop Beginner's Guide,,Garry Turkington,Packt Publishing Ltd,22/2/13,SQL,4.55
9781120000000,Developing Analytic Talent,Becoming a Data Scientist,Vincent Granville,John Wiley & Sons,24/3/14,SQL,5.6
9781630000000,A Guide to the Project Management Body of Knowledge (PMBOK® Guide) – Seventh Edition and The Standard for Project Management (BRAZILIAN PORTUGUESE),,Project Management Institute Project Management Institute,Project Management Institute,1/8/21,SQL,4.22
9781620000000,Fighting Churn with Data,The science and strategy of customer retention,Carl S. Gold,Manning Publications,22/12/20,SQL,3.19
1787283577,SQL Server 2017 Machine Learning Services with R,,"Julie Koesmarno, Tomaz Kastrun",Packt Publishing,27/2/18,SQL,6.9
9781800000000,Cleaning Data for Effective Data Science,"Doing the other 80% of the work with Python, R, and command-line tools",David Mertz,Packt Publishing Ltd,31/3/21,SQL,7.3
9781800000000,Data Science & Business Analytics,,"Sneha Kumari, K. K. Tripathy, Vidya Kumbhar",Emerald Group Publishing,4/12/20,SQL,4.55
9781490000000,Agile Data Science 2.0,Building Full-Stack Data Analytics Applications with Spark,Russell Jurney,"""O'Reilly Media, Inc.""",7/6/17,SQL,5.6
9811518157,Deep Learning Applications,,"M. Arif Wani, Mehmed Kantardzic, Moamar Sayed-Mouchaweh",Springer,29/2/20,SQL,4.22
9781490000000,Data Analytics with Hadoop,An Introduction for Data Scientists,"Benjamin Bengfort, Jenny Kim","""O'Reilly Media, Inc.""",1/6/16,SQL,3.19
9781640000000,Deep Learning with JavaScript,Neural networks in TensorFlow.js,"Stanley Bileschi, Eric Nielsen, Shanqing Cai",Simon and Schuster,24/1/20,SQL,6.9
71592555,"SQL The Complete Reference, 3rd Edition",,"James Groff, Paul Weinberg, Andy Oppel",Mcgraw-hill,12/8/09,SQL,7.3
9789390000000,Data Science with Jupyter,Master Data Science skills with easy-to-follow Python examples,Prateek Gupta,BPB Publications,27/3/19,SQL,4.55
9781800000000,Encyclopedia of Data Science and Machine Learning,,"Wang, John",IGI Global,14/10/22,SQL,5.6
9781120000000,The Data Science Handbook,,Field Cady,John Wiley & Sons,20/1/17,SQL,4.55
1484222466,SQL on Big Data,"Technology, Architecture, and Innovation",SUMIT PAL,Apress,11/12/16,SQL,5.6
9781640000000,Real-World Natural Language Processing,Practical applications with deep learning,Masato Hagiwara,Simon and Schuster,21/12/21,SQL,4.22
9781480000000,SQL Server Big Data Clusters,Early First Edition Based on Release Candidate 1,"Benjamin Weissman, Enrico van de Laar",Apress,26/11/19,SQL,3.19
9781800000000,Machine Learning in Biotechnology and Life Sciences,Build machine learning models using Python and deploy them on the cloud,Saleh Alkhalifa,Packt Publishing Ltd,28/1/22,SQL,6.9
1394181035,Job Ready SQL,,"Kimberly A. Weiss, Haythem Balti",Wiley,9/5/23,SQL,7.3
9781490000000,Practical Data Science with SAP,Machine Learning Techniques for Enterprise Data,"Greg Foss, Paul Modderman","""O'Reilly Media, Inc.""",18/9/19,SQL,4.55
9781490000000,Data Science at the Command Line,,Jeroen Janssens,"""O'Reilly Media, Inc.""",17/8/21,SQL,5.6
9780850000000,Anarchism,From Theory to Practice,Daniel Guerin,NYU Press,1/1/70,SQL,4.22
9780580000000,Getting Started in Data Science,,Ayodele Odubela,fullyConnected Inc.,1/12/20,SQL,3.19
9781790000000,New Trends in Computational Electromagnetics,,Ozgur Ergul,SciTech Publishing,17/1/20,SQL,6.9
321867955,Style,Lessons in Clarity and Grace,"Joseph M. Williams, Joseph Bizup",Pearson Educacion,1/1/13,SQL,7.3
9781110000000,Data Mining and Machine Learning,Fundamental Concepts and Algorithms,"Mohammed J. Zaki, Wagner Meira, Jr",Cambridge University Press,31/12/19,SQL,4.55
9781640000000,Data Analysis with Python and PySpark,,Jonathan Rioux,Simon and Schuster,12/4/22,SQL,5.6
9781800000000,Essential PySpark for Scalable Data Analytics,A beginner's guide to harnessing the power and ease of PySpark 3,Sreeram Nudurupati,Packt Publishing Ltd,29/10/21,SQL,4.22
9789390000000,Data Science Fundamentals and Practical Approaches,,"Nandi Dr. Rupam Dr. Gypsy, Kumar Sharma",BPB Publications,3/9/20,SQL,3.19
9781630000000,Data Scientist,The Definitive Guide to Becoming a Data Scientist,"Zacharias Voulgaris, PhD",Technics Publications,1/5/14,SQL,6.9
9780430000000,Fundamentals of Data Science,,"Sanjeev J. Wagh, Manisha S. Bhende, Anuradha D. Thakare",CRC Press,26/9/21,SQL,7.3
9781490000000,Learning Apache Drill,Query and Analyze Distributed Data Sources with SQL,"Charles Givre, Paul Rogers",O'Reilly Media,2/11/18,SQL,4.55
9781120000000,"A Data Scientist's Guide to Acquiring, Cleaning, and Managing Data in R",,"Samuel E. Buttrey, Lyn R. Whitaker",John Wiley & Sons,24/10/17,SQL,5.6
9781120000000,Python for R Users,A Data Science Approach,Ajay Ohri,John Wiley & Sons,1/11/17,SQL,4.22
